{
  "version": "2026-27.1",
  "finca_id": "LC-001",
  "ejemplo": true,
  "altitud_m": 1450,
  "idioma": "quz",
  "generado": "2026-10-03",
  "clima": {
    "lluvia_floracion_anom_pct": -8,
    "dias_lluvia_nov_abr": 151,
    "dias_lluvia_aprox_mensual": false,
    "dias_temp_roya_90d": 89,
    "tmax_floracion_anom_c": 0.3,
    "fuentes": [
      "CHIRPS v3.0 (mensual y diario sat/IMERG)",
      "NASA POWER (T2M, T2M_MAX)"
    ]
  },
  "registro": {
    "edad_mas_20_sin_recepa": false,
    "cosecha_alta_ano_pasado": true
  },
  "alertas": []
}
